Authors,Title,Journal,Abstract
"['Hancock SD', 'Grant VL.']",Sexually dimorphic effects of postnatal treatment on the development of activity-based anorexia in adolescent and adult rats.,Dev Psychobiol,"Hyperactivity of the hypothalamic-pituitary-adrenal (HPA) axis is a marked feature of anorexia nervosa. Using a modified version of the activity-based animal model of anorexia nervosa, we examine whether factors known to affect HPA axis activity influence the development of activity-based anorexia (ABA). Male and female rats were subjected to maternal separation or handling procedures during the first two postnatal weeks and tested in a mild version of the ABA paradigm, comprised of 2-hr daily running wheel access followed by 1-hr food access, either in adolescence or adulthood. Compared to handled females, maternally separated females demonstrated greater increases in wheel running and a more pronounced running-induced suppression of food intake during adolescence, but not in adulthood. In contrast, it was only in adulthood that wheel running produced more prolonged anorexic effects in maternally separated than in handled males. These findings highlight the interplay between early postnatal treatment, sex of the animal, and developmental age on running, food intake, and rate of body weight loss in a mild version of the ABA paradigm."
"['Suzuki H', 'Asakawa A', 'Li JB', 'Tsai M', 'Amitani H', 'Ohinata K', 'Komai M', 'Inui A.']",Zinc as an appetite stimulator - the possible role of zinc in the progression of diseases such as cachexia and sarcopenia.,Recent Pat Food Nutr Agric,"Zinc is required by humans and animals for many physiological functions, such as growth, immune function, and reproduction. Zinc deficiency induces a number of physiological problems, including anorexia, growth retardation, dermatitis, taste disorder, and hypogonadism. Although it is clear that zinc deficiency produces specific and profound anorexia in experimental animals, the connection between zinc deficiency and anorexia is less certain. We were the first to show that orally, but not intraperitoneally, administered zinc rapidly stimulates food intake through orexigenic peptides coupled to the afferent vagus nerve using rats during early-stage zinc deficiency without decreased zinc concentrations in plasma and tissues. We confirmed that a zinc-sufficient diet containing zinc chloride acutely stimulated food intake after short-term zinc deprivation. We also found that orally administered zinc sulfate increased the expression of NPY and orexin mRNA after administration. Using vagotomized rats, we tested whether the increase in food intake after oral administration of zinc was mediated by the vagus nerve. In sham-operated rats, the oral administration of zinc stimulated food intake, whereas zinc and saline administrations did not exhibit differing effects in vagotomized rats. We conclude that zinc stimulates food intake in short-term zinc-deficient rats through the afferent vagus nerve with subsequent effects on hypothalamic peptides associated with food intake regulation. In this review, we describe recent research investigating the roles of zinc as an appetite stimulator in food intake regulation, along with research about hypothalamus, ghrelin, leptin and zinc receptor, and clinical application about anorexia nervosa, cachexia and sarcopenia. The article also presents some promising patents on zinc."
"['Burden VR', 'White BD', 'Dean RG', 'Martin RJ.']",Activity of the hypothalamic-pituitary-adrenal axis is elevated in rats with activity-based anorexia.,J Nutr,"Activity-based anorexia is characterized by suppressed food intake and excessive physical activity. These behaviors are typical of persons with anorexia nervosa. Activity of the hypothalamic-pituitary-adrenal axis is known to be elevated in anorexia nervosa. We investigated the status of this axis in activity-based anorexia. Meal fed-control (MFC) and meal fed-wheel running (MFWR) rats were given access to food for 90 min daily; MFWR animals were allowed access to an activity wheel the remainder of the day. The experiment terminated when MFWR animals reached 75% of preexperimental body weight (males 3.9 +/- 0.3 d; females 4.2 +/- 0.2 d). Male and female MFWR rats consumed less food than MFC animals, while maintaining a high level of wheel running. Corticosterone concentrations were significantly elevated in MFWR animals. Corticotropin-releasing hormone mRNA concentrations in the paraventricular nucleus were not different. Relative adrenal gland weights were greater and thymus gland weights were lower in MFWR animals. Changes in food intake could not be explained by differences in insulin, glucose, beta-hydroxybutyrate or norepinephrine concentrations. Our results suggest increased activity of the hypothalamic-pituitary-adrenal axis in activity-based anorexia."
"['Atchley DP', 'Eckel LA.']",Treatment with 8-OH-DPAT attenuates the weight loss associated with activity-based anorexia in female rats.,Pharmacol Biochem Behav,"Serotonin (5-HT) plays an important role in controlling food intake and regulating body weight. In addition, clinical studies suggest a possible role for 5-HT in the etiology of anorexia nervosa. Recently, we have examined the effects of pharmacological manipulation of the 5-HT system in female rats exposed to conditions that promote activity-based anorexia (ABA). In this animal model of anorexia nervosa, rats are food restricted (2 h access/day) while given the opportunity to exercise in running wheels. These conditions promote symptoms of anorexia nervosa including hypophagia, hyperactivity, progressive weight loss, and disruptions of the ovarian reproductive cycle. Previously, we demonstrated that increased 5-HT activity increased the weight loss associated with ABA in female rats. Here, we investigated whether decreased 5-HT activity would attenuate symptoms of ABA. Food-restricted female rats received injections of 8-OH-DPAT, a drug that reduces serotonergic neurotransmission, or saline vehicle 40 min prior to food access. During this restricted-feeding phase, food intake was similar between groups; however, 8-OH-DPAT prevented the hyperactivity observed in saline-treated rats. This resulted in less weight loss in 8-OH-DPAT-treated rats, suggesting that decreased activation of the 5-HT system attenuates the development of ABA."
"['Blüher S', 'Mantzoros CS.']",Leptin in humans: lessons from translational research.,Am J Clin Nutr,"Leptin has emerged over the past decade as a key hormone in not only the regulation of food intake and energy expenditure but also in the regulation of neuroendocrine and immune function as well as the modulation of glucose and fat metabolism as shown by numerous observational and interventional studies in humans with (complete) congenital or relative leptin deficiency. These results have led to proof-of-concept studies that have investigated the effect of leptin administration in subjects with complete (congenital) leptin deficiency caused by mutations in the leptin gene as well as in humans with relative leptin deficiency, including states of lipoatrophy or negative energy balance and neuroendocrine dysfunction, as for instance seen with hypothalamic amenorrhea in states of exercise-induced weight loss. In those conditions, most neuroendocrine, metabolic, or immune disturbances can be restored by leptin administration. Leptin replacement therapy is thus a promising approach in several disease states, including congenital complete leptin deficiency, states of energy deprivation, including anorexia nervosa or milder forms of hypothalamic amenorrhea, as well as syndromes of insulin resistance seen in conditions such as congenital or acquired lipodystrophy. In contrast, states of energy excess such as garden-variety obesity are associated with hyperleptinemia that reflects either leptin tolerance or leptin resistance. For those conditions, development of leptin sensitizers is currently a focus of pharmaceutical research. This article summarizes our current understanding of leptin's role in human physiology and its potential role as a novel therapeutic option in human disease states associated with a new hormone deficiency, ie, leptin deficiency."
['Koob GF.'],"Corticotropin-releasing factor, norepinephrine, and stress.",Biol Psychiatry,"Corticotropin-releasing factor (CRF) and related peptides in the central nervous system appears to have activating properties on behavior and to enhance behavioral responses to stressors. CRF and urocortin injected into the brain produces increases in arousal as measured by locomotor activation and increased responsiveness to stressful stimuli. These effects of CRF appear to be independent of the pituitary adrenal axis and can be reversed by specific and selective CRF antagonists alpha-helical CRF9-41 and D-Phe CRF12-41. Perhaps more importantly, CRF antagonists can reverse behavioral responses to many stressors. These results suggest that endogenous CRF systems in the brain may have a role in mediating behavioral responses to stressors. Norepinephrine systems emanating from the nucleus locus coeruleus also long have been hypothesized to be involved in mediating behavioral constructs associated with alertness, arousal, and stress. Pharmacologic, physiologic, and neuroanatomic evidence supports an important role for a CRF-norepinephrine interaction in the region of the locus coeruleus in response to stressors that may be modality-specific where CRF neurons activate the locus coeruleus. One may hypothesize that another norepinephrine-CRF interaction may occur in the terminal projections of the forebrain norepinephrine systems in the paraventricular nucleus of the hypothalamus, the bed nucleus of the stria terminalis, and the central nucleus of the amygdala where norepinephrine stimulates CRF release. Such a feed-forward system may be particularly important in situations where an organism must mobilize not only the pituitary adrenal system but also the central nervous system, in response to environmental challenge. However, such a feed-forward mechanism in a fundamental brain-activating system may be particularly vulnerable to dysfunction and thus, may be the key to a variety of pathophysiologic conditions involving abnormal responses to stressors such as anorexia nervosa, anxiety, and affective disorders."
['Ando T.'],Ghrelin gene variants and eating disorders.,Vitam Horm,"Genetic factors have been implicated in playing a significant role in susceptibility to eating disorders such as anorexia nervosa (AN) and bulimia nervosa (BN). Genetic variants of ghrelin, an endogenous acylated peptide that stimulates growth hormone secretion, enhances appetite, and increases body weight, have been investigated in association with eating disorders, as changes in the ghrelin/growth hormone secretagogue receptor (GHSR)/ghrelin O-acyltransferase (GOAT) system have been implicated in its pathology. Although most candidate-gene association studies have not been able to identify ghrelin gene variants as being significantly associated with either AN or BN, some ghrelin variants may be associated with BN in Japanese. Furthermore, a significant association of a GHSR gene variant with BN and that of a GOAT gene variant with AN have been found. However, there have been relatively few studies, tested variants are restricted, and sample sizes are often modest. Therefore, further studies are needed to elucidate the role of ghrelin-related gene variants in the predisposition and pathology of eating disorders."
"['Mercer LP', 'Kelley DS', 'Haq A', 'Humphries LL.']",Dietary induced anorexia: a review of involvement of the histaminergic system.,J Am Coll Nutr,"This review examines possible relationships between anorexia, dietary intake and central nervous system histaminergic activity. The hypothesis being reviewed is that one component of normal or pathophysiological neuroregulation of food intake involves histaminergic activity in the central nervous system, as influenced by concentrations and bioperiodicities of histamine and/or histamine receptors. Changes in concentrations of receptors are gender specific. Low protein quality or quantity diets elevate both central histamine and histamine receptors (H1) in rats while significantly decreasing their food intake. When injected with histaminergic antagonists, rats fed low protein diets increase food intake and have improved efficiency of weight gain. This review supports a dual hypotheses: central histaminergic activity is involved in the regulation of food intake, but food intake patterns (including dietary composition or energy content) can modify central histaminergic activity. This review also suggests that modified histamine and/or H1 receptor concentrations are potential mechanisms for elevated central histaminergic activity in food intake-related pathophysiological states. Thus, dietary interventions (clinically- or self-imposed) which modify food intake or diet composition have the potential of affecting the histaminergic system. Also, drugs with antihistaminergic properties have the potential of affecting food intake/weight gain patterns by interfering with normal neurochemical signals."
"['Lutter M', 'Croghan AE', 'Cui H.']",Escaping the Golden Cage: Animal Models of Eating Disorders in the Post-Diagnostic and Statistical Manual Era.,Biol Psychiatry,"Eating disorders (EDs) are severe, life-threatening mental illnesses characterized by marked disturbances in body image and eating patterns. Attempts to understand the neurobiological basis of EDs have been hindered by the perception that EDs are primarily socially reinforced behaviors and not the result of a pathophysiologic process. This view is reflected by the diagnostic criteria of anorexia nervosa and bulimia nervosa, which emphasize intrapsychic conflicts such as ""inability to maintain body weight,"" ""undue influence of body weight or shape on self-evaluation,"" and ""denial of the seriousness of low body weight"" over neuropsychological measures. The neuropsychological constructs introduced within the research domain criteria (RDoC) matrix offer new hope for determining the neural substrate underlying the biological predisposition to EDs. We present selected studies demonstrating deficits in patients with EDs within each domain of the RDoC and propose a set of behavioral tasks in model systems that reflect aspects of that deficit. Finally, we propose a battery of tasks to examine comprehensively the function of neural circuits relevant to the development of EDs."
"['Verty AN', 'Evetts MJ', 'Crouch GJ', 'McGregor IS', 'Stefanidis A', 'Oldfield BJ.']",The cannabinoid receptor agonist THC attenuates weight loss in a rodent model of activity-based anorexia.,Neuropsychopharmacology,"Anorexia nervosa (AN) is characterized by anhedonia whereby patients experience little pleasure or reward in many aspects of their lives. Reward pathways and the endocannabionid system have been implicated in the mediation of food intake. The potential to exploit these systems to reverse weight loss is investigated in a rodent model of activity-based anorexia (ABA). The effect of subchronic (6 days) Δ(9)-tetrahydrocannabinol (THC) treatment (0.1, 0.5, or 2.0 mg/kg/day) was assessed on chow and high-fat diet (HFD) intake, body weight, running wheel activity (RWA) as well as thermogenesis in brown adipose tissue (BAT) and lipid metabolism in white adipose tissue (WAT). Limited time availability of food and continuous access to running wheels led to anorexia and significantly reduced body weight. THC treatment (0.5 and 2.0 mg/kg/day) transiently stimulated chow intake with a moderate effect on RWA. THC (2.0 mg/kg/day) significantly reduced body weight loss and shifted markers of thermogenesis in BAT and lipid metabolism in WAT in directions consistent with reduced energy expenditure and lipolysis. THC (2.0 mg/kg/day) combined with HFD, produced a transient increase in food intake, reduction in RWA, attenuation of body weight loss, and changes in markers of thermogensis in BAT and lipolysis in the WAT. These changes were significantly greater than those seen in vehicle (HFD), vehicle (chow), and THC (chow)-treated animals. These data show for the first time the effectiveness of the endocannabinoid system in attenuating the weight loss associated with the development of ABA via a mechanism involving reduced energy expenditure."
"['McClelland J', 'Bozhilova N', 'Campbell I', 'Schmidt U.']",A systematic review of the effects of neuromodulation on eating and body weight: evidence from human and animal studies.,Eur Eat Disord Rev,"Background:
        
      
      Eating disorders (ED) are chronic and sometimes deadly illnesses. Existing treatments have limited proven efficacy, especially in the case of adults with anorexia nervosa (AN). Emerging neural models of ED provide a rationale for more targeted, brain-directed interventions.
    


          Aims:
        
      
      This systematic review has examined the effects of neuromodulation techniques on eating behaviours and body weight and assessed their potential for therapeutic use in ED.
    


          Method:
        
      
      All articles in PubMed, PsychInfo and Web of Knowledge were considered and screened against a priori inclusion/exclusion criteria. The effects of repetitive transcranial magnetic stimulation (rTMS), transcranial direct current stimulation, vagus nerve stimulation (VNS) and deep brain stimulation (DBS) were examined across studies in ED samples, other psychiatric and neurological disorders, and animal models.
    


          Results:
        
      
      Sixty studies were identified. There is evidence for ED symptom reduction following rTMS and DBS in both AN and bulimia nervosa. Findings from studies of other psychiatric and neurological disorders and from animal studies demonstrate that increases in food intake and body weight can be achieved following DBS and that VNS has potential value as a means of controlling eating and inducing weight loss.
    


          Conclusions:
        
      
      Neuromodulation tools have potential for reducing ED symptomatology and related behaviours, and for altering food intake and body weight. In response to such findings, and emerging neural models of ED, treatment approaches are highly unlikely to remain 'brainless'. More research is required to evaluate the potential of neuromodulation procedures for improving long-term outcomes in ED."
"['Welkenhuysen M', 'Van Kuyck K', 'Das J', 'Sciot R', 'Nuttin B.']",Electrical stimulation in the lateral hypothalamus in rats in the activity-based anorexia model.,Neurosurg Focus,"Object:
        
      
      One quarter of patients with anorexia nervosa have a poor outcome and continue to suffer chronically or die. Electrical brain stimulation may be of therapeutic benefit in some of these patients; however, the brain target for inducing symptom relief is unknown. In this study, the authors evaluated the effects of acute and chronic electrical stimulation in the lateral hypothalamus on food intake, locomotor activity, and survival time in rats in an activity-based anorexia model.
    


          Methods:
        
      
      In an acute experiment, the authors electrically stimulated at 100 Hz and 0, 25, 50 and 75% of the maximal stimulation amplitude (that is, the amplitude leading to severe side effects) in the lateral hypothalamus on consecutive days during 4 test sessions in 10 rats and evaluated food intake and locomotor activity. In a chronic experiment, they compared food intake, wheel revolutions, and survival time between 6 rats that underwent electrical stimulation in the lateral hypothalamus (50% of maximal stimulation amplitude) and 8 rats that did not undergo stimulation.
    


          Results:
        
      
      In the acute experiment, overall electrical stimulation (25, 50, and 75% combined) and stimulation at 75% of the maximal stimulation amplitude significantly decreased the locomotor activity. However, if the authors omitted results of 1 rat, in which the electrode tip was not located in the lateral hypothalamus on one side but rather in the supraoptic chiasm, the remaining results did not yield significance. No other differences were observed.
    


          Conclusions:
        
      
      When the findings of the current study are extrapolated to patients with anorexia nervosa, the authors do not expect major effects on symptoms with electrical stimulation at high frequency in the lateral hypothalamus."
"['Hosoda H', 'Kojima M', 'Kangawa K.']","Biological, physiological, and pharmacological aspects of ghrelin.",J Pharmacol Sci,"Ghrelin, identified as an endogenous ligand for the growth hormone secretagogue receptor, functions as a somatotrophic and orexigenic signal from the stomach. Ghrelin has a unique post-translational modification: the hydroxyl group of the third amino acid, usually a serine but in some species a threonine, is esterified by octanoic acid and is essential for ghrelin's biological activities. The secretion of ghrelin increases under conditions of negative energy-balance, such as starvation, cachexia, and anorexia nervosa, whereas its expression decreases under conditions of positive energy-balance such as feeding, hyperglycemia, and obesity. In addition to having a powerful effect on the secretion of growth hormone, ghrelin stimulates food intake and transduces signals to hypothalamic regulatory nuclei that control energy homeostasis. Thus, it is interesting to note that the stomach may play an important role in not only digestion but also pituitary growth hormone release and central feeding regulation. We summarized recent findings on the integration of ghrelin into neuroendocrine networks that regulate food intake, energy balance, gastrointestinal function and growth."
"['Chowdhury TG', 'Wable GS', 'Chen YW', 'Tateyama K', 'Yu I', 'Wang JY', 'Reyes AD', 'Aoki C.']",Voluntary Wheel Running Exercise Evoked by Food-Restriction Stress Exacerbates Weight Loss of Adolescent Female Rats But Also Promotes Resilience by Enhancing GABAergic Inhibition of Pyramidal Neurons in the Dorsal Hippocampus.,Cereb Cortex,"Adolescence is marked by increased vulnerability to mental disorders and maladaptive behaviors, including anorexia nervosa. Food-restriction (FR) stress evokes foraging, which translates to increased wheel running exercise (EX) for caged rodents, a maladaptive behavior, since it does not improve food access and exacerbates weight loss. While almost all adolescent rodents increase EX following FR, some then become resilient by suppressing EX by the second-fourth FR day, which minimizes weight loss. We asked whether GABAergic plasticity in the hippocampus may underlie this gain in resilience. In vitro slice physiology revealed doubling of pyramidal neurons' GABA response in the dorsal hippocampus of food-restricted animals with wheel access (FR + EX for 4 days), but without increase of mIPSC amplitudes. mIPSC frequency increased by 46%, but electron microscopy revealed no increase in axosomatic GABAergic synapse number onto pyramidal cells and only a modest increase (26%) of GABAergic synapse lengths. These changes suggest increase of vesicular release probability and extrasynaptic GABAA receptors and unsilencing of GABAergic synapses. GABAergic synapse lengths correlated with individual's suppression of wheel running and weight loss. These analyses indicate that EX can have dual roles-exacerbate weight loss but also promote resilience to some by dampening hippocampal excitability."
"['Hillebrand JJ', 'Kas MJ', 'Scheurink AJ', 'van Dijk G', 'Adan RA.']",AgRP(83-132) and SHU9119 differently affect activity-based anorexia.,Eur Neuropsychopharmacol,"Activity-based anorexia (ABA) mimics starvation and hyperactivity of anorexia nervosa patients in rats. Activation of the melanocortin (MC) system leads to hypophagia and increased energy expenditure in ad libitum fed rats. Therefore, activation of the MC system might underlie the development and propagation of ABA. Pro-opiomelanocortin (POMC) gene expression is normally decreased during negative energy balance. Strikingly, we found a transient up-regulation of POMC mRNA levels in the arcuate nucleus during the development of ABA, indicating a hyperactive MC system. However, wheel running and food intake were not influenced by treating ABA rats with the competitive antagonist SHU9119. This suggests that agonism of MC receptors by endogenous alpha-melanocyte-stimulating hormone (alpha-MSH) levels does not underlie ABA. Instead, treatment with the inverse agonist AgRP(83-132) did ameliorate signs of ABA. This implies that modulation of constitutive MC receptor activity rather than antagonizing putative alpha-MSH release contributes to the development and propagation of ABA."
