Authors,Title,Journal,Abstract
"['Nergårdh R', 'Ammar A', 'Brodin U', 'Bergström J', 'Scheurink A', 'Södersten P.']",Neuropeptide Y facilitates activity-based-anorexia.,Psychoneuroendocrinology,"The hypothesis that treatment with neuropeptide Y (NPY) can increase running activity and decrease food intake and body weight was tested. Female rats with a running wheel lost more weight than sedentary rats and ran progressively more as the availability of food was gradually reduced. When food was available for only 1h/day, the rats lost control over body weight. Correlatively, the level of NPY mRNA was increased in the hypothalamic arcuate nucleus. This phenomenon, activity-based-anorexia, was enhanced by intracerebroventricular infusion of NPY in rats which had food available during 2h/day. By contrast, NPY stimulated food intake but not wheel running in rats which had food available continuously. These findings are inconsistent with the prevailing theory of the role of the hypothalamus in the regulation of body weight according to which food intake is a homeostatic process controlled by ""orexigenic"" and ""anorexigenic"" neural networks. However, the finding that treatment with NPY, generally considered an ""orexigen"", can increase physical activity and decrease food intake and cause a loss of body weight is in line with the clinical observation that patients with anorexia nervosa are physically hyperactive and eat only little food despite having depleted body fat and up-regulated hypothalamic ""orexigenic"" peptides."
"['Nobis S', 'Goichon A', 'Achamrah N', 'Guérin C', 'Azhar S', 'Chan P', 'Morin A', 'Bôle-Feysot C', 'do Rego JC', 'Vaudry D', 'Déchelotte P', 'Belmonte L', 'Coëffier M.']","Alterations of proteome, mitochondrial dynamic and autophagy in the hypothalamus during activity-based anorexia.",Sci Rep,"Restrictive anorexia nervosa is associated with reduced eating and severe body weight loss leading to a cachectic state. Hypothalamus plays a major role in the regulation of food intake and energy homeostasis. In the present study, alterations of hypothalamic proteome and particularly of proteins involved in energy and mitochondrial metabolism have been observed in female activity-based anorexia (ABA) mice that exhibited a reduced food intake and a severe weight loss. In the hypothalamus, mitochondrial dynamic was also modified during ABA with an increase of fission without modification of fusion. In addition, increased dynamin-1, and LC3II/LC3I ratio signed an activation of autophagy while protein synthesis was increased. In conclusion, proteomic analysis revealed an adaptive hypothalamic protein response in ABA female mice with both altered mitochondrial response and activated autophagy."
['Nestler EJ.'],Treating the brain deep down: Brain surgery for anorexia nervosa?,Nat Med,"Using brain surgery, specific areas in the brain can be stimulated with electrical impulses to reversibly change their activity and alleviate symptoms related to mental illnesses. This so-called deep brain stimulation and other methodological advances that even more selectively activate specific groups of neurons can give us clues as to what neural circuitry is involved in a particular mental disorder and whether therapeutic activation of these brain areas and neurons may be effective. In ""Bedside to Bench"", Eric Nestler discusses two trials of individuals with anorexia nervosa in which deep brain stimulation of different brain areas resulted in improvement of behavioral domains associated with the syndrome. The results and potential of this technique in animals and humans may bring us closer to understanding the neurobiology of anorexia nervosa, which still remains a mystery and poses a challenge for treatment. In ""Bench to Bedside"", Jennifer Warner-Schmidt peruses recent findings that uncover the functional connectivity of brain regions involved in depression and how activation of cortical regions can result in antidepressant effects that can compensate for the malfunction of other brain circuits that results in depression."
"['Jean A', 'Laurent L', 'Bockaert J', 'Charnay Y', 'Dusticier N', 'Nieoullon A', 'Barrot M', 'Neve R', 'Compan V.']",The nucleus accumbens 5-HTR4-CART pathway ties anorexia to hyperactivity.,Transl Psychiatry,"In mental diseases, the brain does not systematically adjust motor activity to feeding. Probably, the most outlined example is the association between hyperactivity and anorexia in Anorexia nervosa. The neural underpinnings of this 'paradox', however, are poorly elucidated. Although anorexia and hyperactivity prevail over self-preservation, both symptoms rarely exist independently, suggesting commonalities in neural pathways, most likely in the reward system. We previously discovered an addictive molecular facet of anorexia, involving production, in the nucleus accumbens (NAc), of the same transcripts stimulated in response to cocaine and amphetamine (CART) upon stimulation of the 5-HT(4) receptors (5-HTR(4)) or MDMA (ecstasy). Here, we tested whether this pathway predisposes not only to anorexia but also to hyperactivity. Following food restriction, mice are expected to overeat. However, selecting hyperactive and addiction-related animal models, we observed that mice lacking 5-HTR(1B) self-imposed food restriction after deprivation and still displayed anorexia and hyperactivity after ecstasy. Decryption of the mechanisms showed a gain-of-function of 5-HTR(4) in the absence of 5-HTR(1B), associated with CART surplus in the NAc and not in other brain areas. NAc-5-HTR(4) overexpression upregulated NAc-CART, provoked anorexia and hyperactivity. NAc-5-HTR(4) knockdown or blockade reduced ecstasy-induced hyperactivity. Finally, NAc-CART knockdown suppressed hyperactivity upon stimulation of the NAc-5-HTR(4). Additionally, inactivating NAc-5-HTR(4) suppressed ecstasy's preference, strengthening the rewarding facet of anorexia. In conclusion, the NAc-5-HTR(4)/CART pathway establishes a 'tight-junction' between anorexia and hyperactivity, suggesting the existence of a primary functional unit susceptible to limit overeating associated with resting following homeostasis rules."
['Rowland NE.'],Protocols Using Rodents to Model Eating Disorders in Humans.,Methods Mol Biol,"Dysfunctional feeding behavior has a bidirectional aspect, too little and too much. The former reflects restricted eating and, in extreme, becomes an eating disorder such as anorexia nervosa (AN). The latter reflects lack of restraint and leads to obesity and life-shortening metabolic syndrome. Both of these dysfunctions have proven extremely difficult to prevent or treat, and the use of animal models that have translational validity may be one of the most cost-effective ways of advancing. This chapter describes some of the laboratory protocols using rodents that are available to model human eating dysfunctions."
"['Benabid AL', 'Torres N.']",New targets for DBS.,Parkinsonism Relat Disord,"The specific effect of DBS at high frequency, discovered during a VIM thalamotomy, was extended to the older targets of ablative neurosurgery such as the pallidum, for tremor in Parkinson's disease (PD), dyskinesias, essential tremor, as well as the internal capsule to treat psychiatric disorders (OCD). A second wave of targets came from basic research, enabled by the low morbidity, reversibility, and adaptability of DBS. This was the case for the subthalamic nucleus (STN) which improves the triad of dopaminergic symptoms, and the pedunculopontine nucleus (PPN) for gait disorders in PD. The new concepts of the role of basal ganglia in psychiatric disorders indicate the subgenual cortex CG 25 for severe resistant depression, the accumbens nucleus for depression, anorexia nervosa, and addiction, and the thalamus intralaminar nuclei for minimally conscious states. Serendipity and a scientific approach have provided several instances where targets have produced unexpected effects (such as STN in OCD), as well as limbic effects observed during attempts at VMH stimulation for obesity: this might offer a novel way to treat mild cognitive impairment, or memory deficits reported in Alzheimer's disease. While these might provide solutions for as yet unsolved problems, attention must be paid to ethical considerations."
"['Ho EV', 'Klenotich SJ', 'McMurray MS', 'Dulawa SC.']",Activity-Based Anorexia Alters the Expression of BDNF Transcripts in the Mesocorticolimbic Reward Circuit.,PLoS One,"Anorexia nervosa (AN) is a complex eating disorder with severe dysregulation of appetitive behavior. The activity-based anorexia (ABA) paradigm is an animal model in which rodents exposed to both running wheels and scheduled feeding develop aspects of AN including paradoxical hypophagia, dramatic weight loss, and hyperactivity, while animals exposed to only one condition maintain normal body weight. Brain-derived neurotrophic factor (BDNF), an activity-dependent modulator of neuronal plasticity, is reduced in the serum of AN patients, and is a known regulator of feeding and weight maintenance. We assessed the effects of scheduled feeding, running wheel access, or both on the expression of BDNF transcripts within the mesocorticolimbic pathway. We also assessed the expression of neuronal cell adhesion molecule 1 (NCAM1) to explore the specificity of effects on BDNF within the mesocorticolimbic pathway. Scheduled feeding increased the levels of both transcripts in the hippocampus (HPC), increased NCAM1 mRNA expression in the ventral tegmental area (VTA), and decreased BDNF mRNA levels in the medial prefrontal cortex (mPFC). In addition, wheel running increased BDNF mRNA expression in the VTA. No changes in either transcript were observed in the nucleus accumbens (NAc). Furthermore, no changes in either transcript were induced by the combined scheduled feeding and wheel access condition. These data indicate that scheduled feeding or wheel running alter BDNF and NCAM1 expression levels in specific regions of the mesocorticolimbic pathway. These findings contribute to our current knowledge of the molecular alterations induced by ABA and may help elucidate possible mechanisms of AN pathology."
"['Belmonte L', 'Achamrah N', 'Nobis S', 'Guérin C', 'Riou G', 'Bôle-Feysot C', 'Boyer O', 'Richard V', 'Rego JC', 'Déchelotte P', 'Goichon A', 'Coëffier M.']",A role for intestinal TLR4-driven inflammatory response during activity-based anorexia.,Sci Rep,"Anorexia nervosa (AN) is associated with low-grade systemic inflammation and altered gut microbiota. However, the molecular origin of the inflammation remains unknown. Toll-like receptors are key regulators of innate immune response and their activation seems also to be involved in the control of food intake. We used activity-based anorexia (ABA) model to investigate the role of TLR4 and its contribution in anorexia-associated low-grade inflammation. Here, we found that ABA affected early the intestinal inflammatory status and the hypothalamic response. Indeed, TLR4 was upregulated both on colonic epithelial cells and intestinal macrophages, leading to elevated downstream mucosal cytokine production. These mucosal changes occurred earlier than hypothalamic changes driving to increased levels of IL-1β and IL-1R1 as well as increased levels of plasma corticosterone. Paradoxically, TLR4-deficient mice exhibited greater vulnerability to ABA with increased mortality rate, suggesting a major contribution of TLR4-mediated responses during ABA-induced weight loss."
"['Klenotich SJ', 'Ho EV', 'McMurray MS', 'Server CH', 'Dulawa SC.']",Dopamine D2/3 receptor antagonism reduces activity-based anorexia.,Transl Psychiatry,"Anorexia nervosa (AN) is an eating disorder characterized by severe hypophagia and weight loss, and an intense fear of weight gain. Activity-based anorexia (ABA) refers to the weight loss, hypophagia and paradoxical hyperactivity that develops in rodents exposed to running wheels and restricted food access, and provides a model for aspects of AN. The atypical antipsychotic olanzapine was recently shown to reduce both AN symptoms and ABA. We examined which component of the complex pharmacological profile of olanzapine reduces ABA. Mice received 5-HT(2A/2C), 5-HT3, dopamine D1-like, D2, D3 or D2/3 antagonist treatment, and were assessed for food intake, body weight, wheel running and survival in ABA. D2/3 receptor antagonists eticlopride and amisulpride reduced weight loss and hypophagia, and increased survival during ABA. Furthermore, amisulpride produced larger reductions in weight loss and hypophagia than olanzapine. Treatment with either D3 receptor antagonist SB277011A or D2 receptor antagonist L-741,626 also increased survival. All the other treatments either had no effect or worsened ABA. Overall, selective antagonism of D2 and/or D3 receptors robustly reduces ABA. Studies investigating the mechanisms by which D2 and/or D3 receptors regulate ABA, and the efficacy for D2/3 and/or D3 antagonists to treat AN, are warranted."
"['Gaetani S', 'Romano A', 'Provensi G', 'Ricca V', 'Lutz T', 'Passani MB.']",Eating disorders: from bench to bedside and back.,J Neurochem,"The central nervous system and viscera constitute a functional ensemble, the gut-brain axis, that allows bidirectional information flow that contributes to the control of feeding behavior based not only on the homeostatic, but also on the hedonic aspects of food intake. The prevalence of eating disorders, such as anorexia nervosa, binge eating and obesity, poses an enormous clinical burden, and involves an ever-growing percentage of the population worldwide. Clinical and preclinical research is constantly adding new information to the field and orienting further studies with the aim of providing a foundation for developing more specific and effective treatment approaches to pathological conditions. A recent symposium at the XVI Congress of the Societá Italiana di Neuroscienze (SINS, 2015) 'Eating disorders: from bench to bedside and back' brought together basic scientists and clinicians with the objective of presenting novel perspectives in the neurobiology of eating disorders. Clinical studies presented by V. Ricca illustrated some genetic aspects of the psychopathology of anorexia nervosa. Preclinical studies addressed different issues ranging from the description of animal models that mimic human pathologies such as anorexia nervosa, diet-induced obesity, and binge eating disorders (T. Lutz), to novel interactions between peripheral signals and central circuits that govern food intake, mood and stress (A. Romano and G. Provensi). The gut-brain axis has received increasing attention in the recent years as preclinical studies are demonstrating that the brain and visceral organs such as the liver and guts, but also the microbiota are constantly engaged in processes of reciprocal communication, with unexpected physiological and pathological implications. Eating is controlled by a plethora of factors; genetic predisposition, early life adverse conditions, peripheral gastrointestinal hormones that act directly or indirectly on the central nervous system, all are receiving attention as they presumably contribute to the development of eating disorders."
['Kim SF.'],Animal models of eating disorders.,Neuroscience,"Feeding is a fundamental process for basic survival and is influenced by genetics and environmental stressors. Recent advances in our understanding of behavioral genetics have provided a profound insight on several components regulating eating patterns. However, our understanding of eating disorders, such as anorexia nervosa, bulimia nervosa, and binge eating, is still poor. The animal model is an essential tool in the investigation of eating behaviors and their pathological forms, yet development of an appropriate animal model for eating disorders still remains challenging due to our limited knowledge and some of the more ambiguous clinical diagnostic measures. Therefore, this review will serve to focus on the basic clinical features of eating disorders and the current advances in animal models of eating disorders."
['Nicholson B.'],Pheromones cause disease: the exocrinology of anorexia nervosa.,Med Hypotheses,"The aetiology of anorexia nervosa is exocrinological. This notion is supported by physical evidence in animal models with directly comparable symptomatology. Anorexia nervosa (AN) syndrome would be a puberty delay caused by reception and autoreception of conspecific pheromone emissions: a pheromone-induced puberty delay (PIPD). As such, it would be amenable to medical treatment drawing from forty years of research in animals. This hypothesis is testable. For instance, since food ad libitum is a prerequisite for PIPD, occasional supervised fasting in healthy peripuberal subjects should prevent AN. Besides, tolerating an untestable thought disease (1,2) with symptoms of a curable well-understood animal condition would be anti-scientific and perpetuates medical disaster. Even their endocrinologies are identical. Pheromone feedback tunes animal appetites and immunity to available resources and prospects. In addition to timing puberty, pheromones regulate fertility. Pheromones will probably be implicated in the aetiology of the psychiatric and autoimmune diseases. This is the second in a series of twelve papers to explore this contention systematically."
"['Berthold-Losleben M', 'Heitmann S', 'Himmerich H.']",Anti-inflammatory drugs in psychiatry.,Inflamm Allergy Drug Targets,"Nervous and immune system interact through many different messenger substances such as neurotransmitters, cytokines or neuropeptides. For instance, neuropeptides are capable of affecting the metabolism of cells belonging to the immune system. Conversely, cytokines such as tumor necrosis factor (TNF)-alpha, interferon (IFN)-alpha and IFN-gamma, contribute to the receptor resistance of neuropeptides, reduce the availability of amino acids which are needed for the synthesis of neurotransmitters or show neurotoxic effects. Other cytokines like granulocyte-colony stimulating factor (G-CSF) may be highly attractive candidates for the treatment of neurodegenerative conditions. Cytokines are decisively involved in the pathophysiology of psychiatric disorders such as depression, schizophrenia or anorexia nervosa as well as in neurological, respectively neurodegenerative diseases like Parkinson's or Alzheimer's. This connection between the immune system and the pathogenesis of psychiatric disorders leads to the concept that immunomodulatory drugs which are already in use for various diseases related to the immune system may also be efficient in the treatment of psychiatric disorders. This article is supposed to give an overview over the current concepts and possibilities since hopefully these hypotheses lead to new therapeutical strategies for psychiatric patients in the future."
"['Wu H', 'van Kuyck K', 'Tambuyzer T', 'Luyten L', 'Aerts JM', 'Nuttin B.']",Rethinking food anticipatory activity in the activity-based anorexia rat model.,Sci Rep,"When a rat is on a limited fixed-time food schedule with full access to a running wheel (activity-based anorexia model, ABA), its activity level will increase hours prior to the feeding period. This activity, called food-anticipatory activity (FAA), is a hypothesized parallel to the hyperactivity symptom in human anorexia nervosa. To investigate in depth the characteristics of FAA, we retrospectively analyzed the level of FAA and activities during other periods in ABA rats. To our surprise, rats with the most body weight loss have the lowest level of FAA, which contradicts the previously established link between FAA and the severity of ABA symptoms. On the contrary, our study shows that postprandial activities are more directly related to weight loss. We conclude that FAA alone may not be sufficient to reflect model severity, and activities during other periods may be of potential value in studies using ABA model."
"['Nobis S', 'Morin A', 'Achamrah N', 'Belmonte L', 'Legrand R', 'Chan P', 'do Rego JL', 'Vaudry D', 'Gourcerol G', 'Déchelotte P', 'Goichon A', 'Coëffier M.']",Delayed gastric emptying and altered antrum protein metabolism during activity-based anorexia.,Neurogastroenterol Motil,"Background:
        
      
      Anorexia nervosa, a restrictive eating disorder, is often associated with gastrointestinal disorders, particularly a delayed gastric emptying. However, the mechanisms remained poorly documented. Thus, we aimed to evaluate gastric emptying and antrum protein metabolism in the Activity-Based Anorexia model (ABA).
    


          Methods:
        
      
      Females C57Bl/6 mice were randomized into 3 groups: Control, ABA, and Limited Food Access (LFA). Food access has been progressively limited from 6 h/day at day 6 to 3 h/day at day 9 and until day 17. ABA mice had free access to an activity wheel. Gastric emptying was assessed. On gastric extracts, a proteomic analysis was performed, as well as an evaluation of protein synthesis and protein oxidation.
    


          Key results:
        
      
      Both LFA and ABA mice exhibited a delayed gastric emptying compared with Controls (P < .05). Proteomic approach revealed 15 proteins that were differentially expressed. Among these proteins, we identified 2 clusters of interest contributing to (i) the organization of muscle fiber with ACTA2, VCL, KRT19, KRT8, and DES proteins and (ii) ""heat shock proteins"" with STIP1, HSPD1, and HSPA8 proteins. ABA mice specifically exhibited an increased rate of gastric oxidized proteins.
    


          Conclusions and inferences:
        
      
      Delayed gastric emptying observed in anorectic conditions appears to be secondary to malnutrition. However, an oxidative stress is specifically present in the stomach of ABA mice. Its role remains to be further studied."
"['Hillebrand JJ', 'van Elburg AA', 'Kas MJ', 'van Engeland H', 'Adan RA.']",Olanzapine reduces physical activity in rats exposed to activity-based anorexia: possible implications for treatment of anorexia nervosa?,Biol Psychiatry,"Background:
        
      
      Anorexia nervosa (AN) patients often show extreme hypophagia and excessive physical activity. Activity-based anorexia (ABA) is considered an animal model of AN and mimics food restriction and hyperactivity in rats. This study investigated whether treatment with olanzapine (Zyprexa) reduces the development of ABA in rats. The effect of olanzapine treatment in AN patients was also evaluated in a small open-label study.
    


          Methods:
        
      
      Rats were chronically (1 week) infused with olanzapine (7.5 mg/kg) and exposed to the ABA model or ad libitum feeding. Hyperactive AN patients were followed for up to 3 months of olanzapine treatment (5 mg/kg).
    


          Results:
        
      
      Olanzapine treatment reduced development of ABA in rats by reducing running wheel activity, starvation-induced hypothermia and activation of the hypothalamus-pituitary-adrenal axis. Olanzapine treatment reduced activity levels of AN patients compared with untreated AN patients, without affecting body weight and plasma leptin levels.
    


          Conclusions:
        
      
      Olanzapine treatment reduced wheel running and thereby diminished development of ABA in rats. Olanzapine treatment also reduced physical activity in hyperactive AN patients in a small open-label study. These data support the need for controlled studies investigating the putative beneficial effects of olanzapine treatment in AN patients."
['Strasser F.'],Clinical application of ghrelin.,Curr Pharm Des,"Ghrelin as a human natural hormone is involved in fundamental regulatory processes of eating and energy balance. Ghrelin signals the nutrient availability from the gastrointestinal tract to the central nervous system, up-regulates food intake and lowers energy expenditure mainly through hypothalamic mediators acting both centrally and peripherally including the gastrointestinal tract (motility, epithelium), promotes both neuro-endocrine and inflammatory signals to increase skeletal muscle growth and decrease protein breakdown, and increases lipolysis while body fat utilization is reduced. Ghrelin does more to exert its probably sentinel role around ""human energy"": it influences through mainly extra-hypothalamic actions the hedonic and incentive value of food, mood and anxiety, sleep-wake regulation, learning and memory, and neurogenesis. Recently numerous ghrelin gene-derived peptides were discovered, demonstrating the complexity within the ghrelin/ghrelin receptor axis. For clinical applications, not only the natural ghrelin and its slice variants, but also several modified or artificial molecules acting at ghrelin-associated receptors were and are developed. Current clinical applications are limited to clinical studies, focusing mainly on cachexia in chronic heart failure, COPD, cancer, endstage- renal-disease or cystic fibrosis, but also on frailty in elderly, gastrointestinal motility (e.g., gastroparesis, functional dyspepsia, postoperative ileus), after curative gastrectomy, anorexia nervosa, growth hormone deficient patients, alcohol craving, sleep-wake regulation (e.g. major depression), or sympathetic nervous activity in obesity. The results of completed, preliminary studies support the clinical potential of ghrelin, ghrelin gene-derived peptides, and artificial analogues, suggesting that larger clinical trials are demanded to move ghrelin towards an available and reimbursed pharmaceutical intervention."
