Authors,Title,Journal,Abstract
"['Adams KL', 'Parfeniuk GG', 'Eikelboom R.']",Chlorpromazine specifically prevents the wheel-induced feeding suppression in rats.,Pharmacol Biochem Behav,"In rats, limited daytime wheel access suppresses feeding over the subsequent night [Lattanzio SB, Eikelboom R. Wheel access duration in rats: I. effects on feeding and running. Behav Neurosci 2003; 117:496-504.]. This phenomenon is known as the wheel-induced feeding suppression (WIFS). The classic antipsychotic, chlorpromazine, can minimize the severity of the related activity anorexia procedure, but is thought to act through a suppression of running [Routtenberg A. ""Self-starvation"" of rats living in activity wheels: adaptation effects. J Comp Physiol Psychol 1968; 66:234-8.]. We tested the effects of chlorpromazine (2mg/kg IP) on the acute WIFS in 40 adult male rats by administering the drug before or after 3h of daytime wheel access and measuring food consumption over the subsequent 24h. Control groups received saline injections or were exposed to locked wheels. While chlorpromazine did not attenuate feeding or change wheel running alone, it blocked their interaction, the acute WIFS. This procedure might be useful in screening drugs for anorexia nervosa where exercise is often elevated and feeding is suppressed."
['Smith SS.'],The influence of stress at puberty on mood and learning: role of the α4βδ GABAA receptor.,Neuroscience,"It is well-known that the onset of puberty is associated with changes in mood as well as cognition. Stress can have an impact on these outcomes, which in many cases, can be more influential in females, suggesting that gender differences exist. The adolescent period is a vulnerable time for the onset of certain psychopathologies, including anxiety disorders, depression and eating disorders, which are also more prevalent in females. One factor which may contribute to stress-triggered anxiety at puberty is the GABAA receptor (GABAR), which is known to play a pivotal role in anxiety. Expression of α4βδ GABARs increases on the dendrites of CA1 pyramidal cells at the onset of puberty in the hippocampus, part of the limbic circuitry which governs emotion. This receptor is a sensitive target for the stress steroid 3α-OH-5[α]β-pregnan-20-one or [allo]pregnanolone, which paradoxically reduces inhibition and increases anxiety during the pubertal period (post-natal day ∼35-44) of female mice in contrast to its usual effect to enhance inhibition and reduce anxiety. Spatial learning and synaptic plasticity are also adversely impacted at puberty, likely a result of increased expression of α4βδ GABARs on the dendritic spines of CA1 hippocampal pyramidal cells, which are essential for consolidation of memory. This review will focus on the role of these receptors in mediating behavioral changes at puberty. Stress-mediated changes in mood and cognition in early adolescence may have relevance for the expression of psychopathologies in adulthood."
['Tsai SJ.'],Repetitive transcranial magnetic stimulation: a possible novel therapeutic approach to eating disorders.,Med Hypotheses,"The two most common eating disorders, anorexia nervosa and bulimia nervosa, are characterized by aberrant eating patterns and disturbances in body image. Treatment involves combining individual, behavioural, group, and family therapies, possibly with medications. Studies have found that medication, chiefly antidepressants, could be of help in bulimia nervosa but the evidence is weaker for use in anorexia nervosa. Repetitive transcranial magnetic stimulation (rTMS) is a non-invasive technique that briefly stimulates or depresses cortical areas within the brain. It has been used in the treatment of various psychiatric disorders, especially major depression, which is a condition that patients with eating disorders often experience as a significant comorbidity. Given that both disorders may share a common pathogenesis, this report proposes that rTMS may represent an alternative strategy for the treatment of eating disorders. Other evidence that supports this notion comes from animal studies that show that rTMS can change feeding behaviours and central neurotransmitters related to the regulation of eating behaviours. Further investigation into the dose, duration and type of rTMS stimulus is needed to verify the efficacy of this intervention in eating disorders."
"['Benabid AL', 'Wallace B', 'Mitrofanis J', 'Xia C', 'Piallat B', 'Fraix V', 'Batir A', 'Krack P', 'Pollak P', 'Berger F.']",Therapeutic electrical stimulation of the central nervous system.,C R Biol,"The electrical effects on the nervous system have been known for long. The excitatory effect has been used for diagnostic purposes or even for therapeutic applications, like in pain using low-frequency stimulation of the spinal cord or of the thalamus. The discovery that High-Frequency Stimulation (HFS) mimics the effect of lesioning has opened a new field of therapeutic application of electrical stimulation in all places where lesion of neuronal structures, such as nuclei of the basal ganglia, had proven some therapeutic efficiency. This was first applied to the thalamus to mimic thalamotomy for the treatment of tremor, then to the subthalamic nucleus and the pallidum to treat some advanced forms of Parkinson's disease and control not only the tremor but also akinesia, rigidity and dyskinesias. The field of application is increasingly growing, currently encompassing dystonias, epilepsy, obsessive compulsive disease, cluster headaches, and experimental approaches are being made in the field of obesity and food intake control. Although the effects of stimulation are clear-cut and the therapeutic benefit is clearly recognized, the mechanism of action of HFS is not yet understood. The similarity between HFS and the effect of lesions in several places of the brain suggests that this might induce an inhibition-like process, which is difficult to explain with the classical concept of physiology where electrical stimulation means excitation of neural elements. The current data coming from either clinical or experimental observations are providing elements to shape a beginning of an understanding. Intra-cerebral recordings in human patients with artefact suppression tend to show the arrest of electrical firing in the recorded places. Animal experiments, either in vitro or in vivo, show complex patterns mixing inhibitory effects and frequency stimulation induced bursting activity, which would suggest that the mechanism is based upon the jamming of the neuronal message, which is by this way functionally suppressed. More recent data from in vitro biological studies show that HFS profoundly affects the cellular functioning and particularly the protein synthesis, suggesting that it could alter the synaptic transmission by reducing the production of neurotransmitters. It is now clear that this method has a larger field of application than currently known and that its therapeutical applications will benefit to several diseases of the nervous system. The understanding of the mechanism has opened a new field of research, which will call for reappraisal of the basic effects of electricity on the living tissues."
"['Rieg TS', 'Aravich PF.']",Systemic clonidine increases feeding and wheel running but does not affect rate of weight loss in rats subjected to activity-based anorexia.,Pharmacol Biochem Behav,"Activity-based anorexia (ABA) is an animal model of anorexia nervosa with two characteristics of the disorder, decreased food intake and increased activity. We have shown that chronic noradrenergic stimulation of the paraventricular hypothalamus exacerbates ABA rather than ameliorates it. This study determined if peripheral chronic administration of clonidine affects ABA. Rats were implanted SC with osmotic minipumps infusion 0, 30, or 300 micrograms/kg/day of clonidine and exposed to ABA (1.5 h/day ad lib food, 22.5 h/day ad lib wheel access). Results showed that clonidine did not affect the rate of weight loss during ABA, but increased food intake at the lower dose and wheel activity at the higher dose. It is proposed that increased energy expenditure due to wheel running is counteracted by an inhibition of sympathetically mediated diet-induced thermogenesis, and that the elevation in running by the higher dose potentially increases the risk of developing ABA."
['Ishii DN.'],Implication of insulin-like growth factors in the pathogenesis of diabetic neuropathy.,Brain Res Brain Res Rev,"Neuropathy can be a highly debilitating complication for about 10-15% of diabetic individuals. Unfortunately, the complex syndrome has proven difficult to explain and a consensus as to its cause has not emerged. It has recently come to light that insulin and insulin-like growth factors (IGFs) have neurotrophic actions on sensory, sympathetic and motor neurons. These are the main types of neurons afflicted in this disorder. Moreover, IGF activity is reduced in both clinical and experimental diabetes. The premise that insulin, IGF-I and IGF-II provide redundant neurotrophic support underlies the following new theory for pathogenesis of diabetic neural disturbances: a loss of insulin activity leads to a secondary partial decline in IGF-I activity. Although most of the redundant neurotrophic support is thereby eliminated, IGF-II activity continues to support the nervous system. The final enemy is time and the relentless age- and duration-dependent run-down of IGF activity is suggested to contribute to the age- and duration-dependent neuropathy. Weight loss or anorexia nervosa are independent risk factors that can cause a rapid, painful neuropathy to develop as a result of a rapid loss of IGF activity. A distinguishing feature of this new theory is that hyperglycemia is not considered to be the main culprit. The following critical predictions from the theory were tested in diabetic rats: (i) IGF activity is reduced in diabetic neural tissues; (ii) conduction velocity is impaired in the diabetic spinal cord; (iii) replacement therapy with IGF can prevent neuropathy in diabetic nerves; and (iv) IGFs can prevent diabetic neuropathy, despite hyperglycemia. All of these predictions have been validated. It is hoped that a fresh perspective will stimulate renewed study into the causation of this most unfortunate disorder."
"['Koob GF', 'Heinrichs SC.']",A role for corticotropin releasing factor and urocortin in behavioral responses to stressors.,Brain Res,"Corticotropin-releasing factor (CRF) and CRF-related neuropeptides have an important role in the central nervous system to mediate behavioral responses to stressors. CRF receptor antagonists are very effective in reversing stress-induced suppression and activation in behavior. An additional CRF-like neuropeptide, urocortin, has been identified in the brain and has a high affinity for the CRF-2 receptor in addition to the CRF-1 receptor. Urocortin has many of the effects of CRF but also is significantly more potent than CRF in decreasing feeding in both meal-deprived and free-feeding rats. In mouse genetic models, mice over-expressing CRF show anxiogenic-like responses compared to wild-type mice, and mice lacking the CRF-1 receptor showed an anxiolytic-like behavioral profile compared to wild-type mice. Results to date have led to the hypothesis that CRF-1 receptors may mediate CRF-like neuropeptide effects on behavioral responses to stressors, but CRF-2 receptors may mediate the suppression of feeding produced by CRF-like neuropeptides. Brain sites for the behavioral effects of CRF include the locus coeruleus (LC), paraventricular nucleus (PVN) of the hypothalamus, the bed nucleus of the stria terminalis (BNST), and the central nucleus of the amygdala. CRF may also be activated during acute withdrawal from all major drugs of abuse, and recent data suggest that CRF may contribute to the dependence and vulnerability to relapse associated with chronic administration of drugs of abuse. These data suggest that CRF systems in the brain have a unique role in mediating behavioral responses to diverse stressors. These systems may be particularly important in situations were an organism must mobilize not only the pituitary adrenal system, but also the central nervous system in response to environmental challenge. Clearly, dysfunction in such a fundamental brain-activating system may be the key to a variety of pathophysiological conditions involving abnormal responses to stressors such as anxiety disorders, affective disorders, and anorexia nervosa."
['Levenson CW.'],Zinc regulation of food intake: new insights on the role of neuropeptide Y.,Nutr Rev,"The role of neuropeptide Y (NPY) in feeding behavior and zinc deficiency-induced anorexia has been controversial because hypothalamic NPY levels are elevated in both zinc deficiency and food restriction. A recent report shows that while NPY is released from terminals in the paraventricular nucleus of the hypothalamus of food-restricted animals, this release is significantly impaired in zinc-deficient animals. Zinc deficiency may therefore cause anorexia by inhibiting the release of NPY that is required for receptor activation."
['Bulik CM.'],Abuse of drugs associated with eating disorders.,J Subst Abuse,"Concomitant bulimia nervosa and drug abuse are common in women. Drugs used by this group include diuretics, emetics, laxatives, and diet pills, as well as alcohol, cigarettes, and illicit street drugs. This paper applies principles from behavioral pharmacology to the problem of drug use by women with bulimia nervosa. The prevalence of use, primary effects, toxicity, detection, tolerance, withdrawal, and effects on appetite and weight are discussed for drugs used by bulimic women to reduce appetite or weight or to induce purging (e.g., diuretics, emetics, laxatives, and diet aids). Alternatives in the diagnosis and treatment of drug use in women with eating disorders are discussed."
['Klump KL.'],Puberty as a critical risk period for eating disorders: a review of human and animal studies.,Horm Behav,"This article is part of a Special Issue ""Puberty and Adolescence"". Puberty is one of the most frequently discussed risk periods for the development of eating disorders. Prevailing theories propose environmentally mediated sources of risk arising from the psychosocial effects (e.g., increased body dissatisfaction, decreased self-esteem) of pubertal development in girls. However, recent research highlights the potential role of ovarian hormones in phenotypic and genetic risk for eating disorders during puberty. The goal of this paper is to review data from human and animal studies in support of puberty as a critical risk period for eating disorders and evaluate the evidence for hormonal contributions. Data are consistent in suggesting that both pubertal status and pubertal timing significantly impact risk for most eating disorders in girls, such that advanced pubertal development and early pubertal timing are associated with increased rates of eating disorders and their symptoms in both cross-sectional and longitudinal research. Findings in boys have been much less consistent and suggest a smaller role for puberty in risk for eating disorders in boys. Twin and animal studies indicate that at least part of the female-specific risk is due to genetic factors associated with estrogen activation at puberty. In conclusion, data thus far support a role for puberty in risk for eating disorders and highlight the need for additional human and animal studies of hormonal and genetic risk for eating disorders during puberty."
"['Butt I', 'Hong A', 'Di J', 'Aracena S', 'Banerjee P', 'Shen CH.']",The effects of serotonin1A receptor on female mice body weight and food intake are associated with the differential expression of hypothalamic neuropeptides and the GABAA receptor.,Neuropeptides,"Both common eating disorders anorexia nervosa and bulimia nervosa are characteristically diseases of women. To characterize the role of the 5-HT1A receptor (5-HT1A-R) in these eating disorders in females, we investigated the effect of saline or 8-hydroxy-2-(di-n-propylamino) tetralin (8-OH-DPAT) treatment on feeding behavior and body weight in adult WT female mice and in adult 5-HT1A-R knockout (KO) female mice. Our results showed that KO female mice have lower food intake and body weight than WT female mice. Administration of 8-OH-DPAT decreased food intake but not body weight in WT female mice. Furthermore, qRT-PCR was employed to analyze the expression levels of neuropeptides, γ-aminobutyric acid A receptor subunit β (GABAA β subunits) and glutamic acid decarboxylase in the hypothalamic area. The results showed the difference in food intake between WT and KO mice was accompanied by differential expression of POMC, CART and GABAA β2, and the difference in body weight between WT and KO mice was associated with significantly different expression levels of CART and GABAA β2. As such, our data provide new insight into the role of 5-HT1A-R in both feeding behavior and the associated expression of neuropeptides and the GABAA receptor."
"['Ghigo E', 'Arvat E', 'Camanni F.']",Orally active growth hormone secretagogues: state of the art and clinical perspectives.,Ann Med,"Growth hormone secretagogues (GHS) are synthetic, non-natural peptidyl and nonpeptidyl molecules with potent stimulatory effect on somatotrope secretion. They have no structural homology with growth hormone-releasing hormone (GHRH) and act via a specific receptor, which has now been cloned and is present at both the pituitary and hypothalamic level. This evidence strongly suggests the existence of a still unknown natural GHS-like ligand. Several data favour the hypothesis that GHS could counteract somatostatinergic activity at both the pituitary and hypothalamic level and/or, at least partially, via a GHRH-mediated mechanism. However, the possibility that they act via an unknown hypothalamic factor remains open. GH-releasing peptide-6 (GHRP-6) is the first hexapeptide studied extensively in humans. More recently, peptidyl superanalogues GHRP-1, GHRP-2 and hexarelin, and nonpeptidyl mimetics, such as the spiroindoline derivative MK-677, have been synthesized and their effects have been studied in humans. The GH-releasing activity of GHS is marked, dose related and reproducible after intravenous, subcutaneous, intranasal and even oral administration. The effect of GHS is partially desensitized but prolonged, intermittent oral administration increases insulin-like growth factor I (IGF-I) levels. The GH-releasing effect of GHS undergoes age-related variations; it increases from birth to puberty, remains similar in adulthood and decreases with ageing. The effect of GHS on GH release is synergistic with that of GHRH, while it is only partially refractory to inhibitory influences, which nearly abolish the effect of GHRH. GHS maintain their GH-releasing activity in some somatotrope hypersecretory states such as acromegaly, anorexia nervosa, hyperthyroidism and critical illness. The GH response to GHS has been reported clear although reduced in GH deficiency, obesity and hypothyroidism, while it is strongly reduced in patients with pituitary stalk disconnection or Cushing's syndrome. In short children, elderly subjects, critically ill patients and even in adult patients with GH deficiency an increase of IGF-I has been shown after GHS treatment. These data indicate that treatment with orally active GHS in humans enhances the activity of the GH-IGF-I axis and could be clinically useful."
"['Sinclair EB', 'Culbert KM', 'Gradl DR', 'Richardson KA', 'Klump KL', 'Sisk CL.']",Differential mesocorticolimbic responses to palatable food in binge eating prone and binge eating resistant female rats.,Physiol Behav,"Binge eating is a key symptom of many eating disorders (e.g. binge eating disorder, bulimia nervosa, anorexia nervosa binge/purge type), yet the neurobiological underpinnings of binge eating are poorly understood. The mesocorticolimbic reward circuit, including the nucleus accumbens and the medial prefrontal cortex, is likely involved because this circuit mediates the hedonic value and incentive salience of palatable foods (PF). Here we tested the hypothesis that higher propensity for binge eating is associated with a heightened response (i.e., Fos induction) of the nucleus accumbens and medial prefrontal cortex to PF, using an animal model that identifies binge eating prone (BEP) and binge eating resistant (BER) rats. Forty adult female Sprague-Dawley rats were given intermittent access to PF (high fat pellets) 3×/week for 3 weeks. Based on a pattern of either consistently high or consistently low PF consumption across these feeding tests, 8 rats met criteria for categorization as BEP, and 11 rats met criteria for categorization as BER. One week after the final feeding test, BEP and BER rats were either exposed to PF in their home cages or were given no PF in their home cages for 1h prior to perfusion, leading to three experimental groups for the Fos analysis: BEPs given PF, BERs given PF, and a No PF control group. The total number of Fos-immunoreactive (Fos-ir) cells in the nucleus accumbens core and shell, and the cingulate, prelimbic, and infralimbic regions of the medial prefrontal cortex was estimated by stereological analysis. PF induced higher Fos expression in the nucleus accumbens shell and core and in the prelimbic and infralimbic cortex of BEP rats compared to No PF controls. Throughout the nucleus accumbens and medial prefrontal cortex, PF induced higher Fos expression in BEP than in BER rats, even after adjusting for differences in PF intake. Differences in the neural activation pattern between BEP and BER rats were more robust in prefrontal cortex than in nucleus accumbens. These data confirm that PF activates brain regions responsible for encoding the incentive salience and hedonic properties of PF, and suggest that binge eating proneness is associated with enhanced responses to PF in brain regions that exert executive control over food reward."
"['Boekhoudt L', 'Omrani A', 'Luijendijk MC', 'Wolterink-Donselaar IG', 'Wijbrans EC', 'van der Plasse G', 'Adan RA.']","Chemogenetic activation of dopamine neurons in the ventral tegmental area, but not substantia nigra, induces hyperactivity in rats.",Eur Neuropsychopharmacol,"Hyperactivity is a core symptom in various psychiatric disorders, including attention-deficit/hyperactivity disorder, schizophrenia, bipolar disorders, and anorexia nervosa. Although hyperactivity has been linked to dopaminergic signalling, the causal relationship between midbrain dopamine neuronal activity and locomotor hyperactivity remains unknown. In this study, we test whether increased dopamine neuronal activity is sufficient to induce locomotor hyperactivity. To do so, we used designer receptors exclusively activated by designer drugs (DREADD) to chemogenetically enhance neuronal activity in two main midbrain dopamine neuron populations, i.e. the ventral tegmental area (VTA) and substantia nigra pars compacta (SN), in TH:Cre rats. We found that activation of VTA dopamine neurons induced a pronounced and long-lasting hyperactive phenotype, whilst SN dopamine neuron activation only modestly increased home cage locomotion. Furthermore, this hyperactive phenotype was replicated by selective activation of the neuronal pathway from VTA to the nucleus accumbens (NAC). These results show a clear functional difference between neuronal subpopulations in the VTA and SN with regards to inducing locomotor hyperactivity, and suggest that the dopaminergic pathway from VTA to NAC may be a promising target for the treatment of hyperactivity disorders."
"['Verhagen LA', 'Luijendijk MC', 'Korte-Bouws GA', 'Korte SM', 'Adan RA.']",Dopamine and serotonin release in the nucleus accumbens during starvation-induced hyperactivity.,Eur Neuropsychopharmacol,"Activity-based anorexia (ABA) is considered an animal model for anorexia nervosa (AN). By scheduled feeding and voluntary wheel running, it mimics severe body weight loss and increased physical activity in AN. Pharmacological, genetic and imaging studies implicate dopamine and serotonin in the regulation of feeding behavior, food-anticipatory activity, and food reward. Previous studies propose that the nucleus accumbens (NAc) plays an important role in these food-related processes. Here we determined dopamine and serotonin levels in the NAc upon exposure to the ABA model. Surprisingly, the release of dopamine and serotonin in the NAc were not increased during the initiation of food-anticipatory behavior in ABA rats. Dopamine release in the NAc was increased during feeding behavior in ABA rats. During ABA, levels of serotonin were low and circadian activity is blunted. We conclude that during the early stages of development of food-anticipatory activity, increased dopamine does not trigger hyperactivity."
